city,state,country,location_latitude,location_longitude,title,description,property_type,status,price,bedrooms,bathrooms,amenities,property_latitude,property_longitude,primary_image_url,image_urls,image_captions
Miami,Florida,USA,25.862787,-80.238906,MiLuSol,"MiLuSol is a hostel rental in Miami, Florida, USA. It has 8 bedroom(s) and 1 bathroom(s). Amenities include Parking, Internet.",hostel,available,12.00,8,1,"Parking, Internet",25.878897,-80.229576,https://beta.imgservice.rentbyowner.com/640x300/milusol-us-miami-bc-5721977-0.jpg,https://beta.imgservice.rentbyowner.com/640x300/milusol-us-miami-bc-5721977-1.jpg|https://beta.imgservice.rentbyowner.com/640x300/milusol-us-miami-bc-5721977-2.jpg|https://beta.imgservice.rentbyowner.com/640x300/milusol-us-miami-bc-5721977-3.jpg|https://beta.imgservice.rentbyowner.com/640x300/milusol-us-miami-bc-5721977-4.jpg,Living room|Bedroom|Kitchen|Outdoor area
Van Horn,Texas,USA,30.750296,-104.803131,"Desert Gardens Oasis Camping in Lobo, TX","Desert Gardens Oasis Camping in Lobo, TX is a other rental in Van Horn, Texas, USA. It has 150 bedroom(s) and 2 bathroom(s). Amenities include Pet Friendly, View, Sports/Activities, Bedding/Linens, Child Friendly.",other,available,14.00,150,2,"Pet Friendly, View, Sports/Activities, Bedding/Linens, Child Friendly",30.753886,-104.792421,https://beta.imgservice.rentbyowner.com/640x300/desert-gardens-oasis-camp-us-van-horn-bc-8931087-0.jpg,https://beta.imgservice.rentbyowner.com/640x300/desert-gardens-oasis-camp-us-van-horn-bc-8931087-1.jpg|https://beta.imgservice.rentbyowner.com/640x300/desert-gardens-oasis-camp-us-van-horn-bc-8931087-2.jpg|https://beta.imgservice.rentbyowner.com/640x300/desert-gardens-oasis-camp-us-van-horn-bc-8931087-3.jpg|https://beta.imgservice.rentbyowner.com/640x300/desert-gardens-oasis-camp-us-van-horn-bc-8931087-4.jpg,Living room|Bedroom|Kitchen|Outdoor area
Overland Park,Kansas,USA,38.971008,-94.663540,Comfy Room,"Comfy Room is a house rental in Overland Park, Kansas, USA. It has 1 bedroom(s) and 1 bathroom(s). Amenities include Air Conditioner, Parking, Security/Safety, Fireplace/Heating, Internet.",house,available,15.00,1,1,"Air Conditioner, Parking, Security/Safety, Fireplace/Heating, Internet",38.984718,-94.645890,https://beta.imgservice.rentbyowner.com/640x300/comfy-room-us-overland-park-bc-6721451-0.jpg,https://beta.imgservice.rentbyowner.com/640x300/comfy-room-us-overland-park-bc-6721451-1.jpg|https://beta.imgservice.rentbyowner.com/640x300/comfy-room-us-overland-park-bc-6721451-2.jpg|https://beta.imgservice.rentbyowner.com/640x300/comfy-room-us-overland-park-bc-6721451-3.jpg|https://beta.imgservice.rentbyowner.com/640x300/comfy-room-us-overland-park-bc-6721451-4.jpg,Living room|Bedroom|Kitchen|Outdoor area
Miami,Florida,USA,25.862787,-80.238906,Miami Cheapest Place,"Miami Cheapest Place is a hostel rental in Miami, Florida, USA. It has 16 bedroom(s) and 1 bathroom(s). Amenities include Guest Services, Internet, Kitchen.",hostel,available,15.00,16,1,"Guest Services, Internet, Kitchen",25.879637,-80.245106,https://beta.imgservice.rentbyowner.com/640x300/miami-cheapest-place-us-miami-bc-5573225-0.jpg,https://beta.imgservice.rentbyowner.com/640x300/miami-cheapest-place-us-miami-bc-5573225-1.jpg|https://beta.imgservice.rentbyowner.com/640x300/miami-cheapest-place-us-miami-bc-5573225-2.jpg|https://beta.imgservice.rentbyowner.com/640x300/miami-cheapest-place-us-miami-bc-5573225-3.jpg|https://beta.imgservice.rentbyowner.com/640x300/miami-cheapest-place-us-miami-bc-5573225-4.jpg,Living room|Bedroom|Kitchen|Outdoor area
Stillwater,Oklahoma,USA,36.117092,-97.126433,Hotel 2 Queen Beds Hotel Room 131 Wi-Fi,"Hotel 2 Queen Beds Hotel Room 131 Wi-Fi is a apartment rental in Stillwater, Oklahoma, USA. It has 1 bedroom(s) and 1 bathroom(s). Amenities include Air Conditioner, Parking, Pet Friendly, Balcony/Terrace, Security/Safety, Wellness Facilities, Guest Services, Barbecue/Outdoor Cooking, Child Friendly, Hot Tub, Internet, Laundry.",apartment,available,16.00,1,1,"Air Conditioner, Parking, Pet Friendly, Balcony/Terrace, Security/Safety, Wellness Facilities, Guest Services, Barbecue/Outdoor Cooking, Child Friendly, Hot Tub, Internet, Laundry",36.131302,-97.124243,https://beta.imgservice.rentbyowner.com/640x300/hotel-2-queen-beds-hote-us-stillwater-bc-9647581-0.jpg,https://beta.imgservice.rentbyowner.com/640x300/hotel-2-queen-beds-hote-us-stillwater-bc-9647581-1.jpg|https://beta.imgservice.rentbyowner.com/640x300/hotel-2-queen-beds-hote-us-stillwater-bc-9647581-2.jpg|https://beta.imgservice.rentbyowner.com/640x300/hotel-2-queen-beds-hote-us-stillwater-bc-9647581-3.jpg|https://beta.imgservice.rentbyowner.com/640x300/hotel-2-queen-beds-hote-us-stillwater-bc-9647581-4.jpg,Living room|Bedroom|Kitchen|Outdoor area
Miami,Florida,USA,25.862787,-80.238906,Hola Hostel - Open 24hr FREE DINNER - Under New Management,"Hola Hostel - Open 24hr FREE DINNER - Under New Management is a hostel rental in Miami, Florida, USA. It has 12 bedroom(s) and 1 bathroom(s). Amenities include Air Conditioner, Parking, Security/Safety, Business Services, Fireplace/Heating, Guest Services, Internet.",hostel,available,16.35,12,1,"Air Conditioner, Parking, Security/Safety, Business Services, Fireplace/Heating, Guest Services, Internet",25.874997,-80.221856,https://beta.imgservice.rentbyowner.com/640x300/hola-hostel-open-24hr-free-us-miami-bc-10105544-0.jpg,https://beta.imgservice.rentbyowner.com/640x300/hola-hostel-open-24hr-free-us-miami-bc-10105544-1.jpg|https://beta.imgservice.rentbyowner.com/640x300/hola-hostel-open-24hr-free-us-miami-bc-10105544-2.jpg|https://beta.imgservice.rentbyowner.com/640x300/hola-hostel-open-24hr-free-us-miami-bc-10105544-3.jpg|https://beta.imgservice.rentbyowner.com/640x300/hola-hostel-open-24hr-free-us-miami-bc-10105544-4.jpg,Living room|Bedroom|Kitchen|Outdoor area
Miami,Florida,USA,25.862787,-80.238906,Peace and Quiet Dorm Rooms - Free Breakfast DIY Waffles - Free Dinner - Free Coffee - Longterm Ok!,"Peace and Quiet Dorm Rooms - Free Breakfast DIY Waffles - Free Dinner - Free Coffee - Longterm Ok! is a hostel rental in Miami, Florida, USA. It has 11 bedroom(s) and 1 bathroom(s). Amenities include Parking, View, Security/Safety, Internet, Kitchen.",hostel,available,18.00,11,1,"Parking, View, Security/Safety, Internet, Kitchen",25.852547,-80.249486,https://beta.imgservice.rentbyowner.com/640x300/peace-and-quiet-dorm-rooms-us-miami-bc-15409171-0.jpg,https://beta.imgservice.rentbyowner.com/640x300/peace-and-quiet-dorm-rooms-us-miami-bc-15409171-1.jpg|https://beta.imgservice.rentbyowner.com/640x300/peace-and-quiet-dorm-rooms-us-miami-bc-15409171-2.jpg|https://beta.imgservice.rentbyowner.com/640x300/peace-and-quiet-dorm-rooms-us-miami-bc-15409171-3.jpg|https://beta.imgservice.rentbyowner.com/640x300/peace-and-quiet-dorm-rooms-us-miami-bc-15409171-4.jpg,Living room|Bedroom|Kitchen|Outdoor area
Lawton,Oklahoma,USA,34.636384,-98.423263,Simple 1-bedroom unit upstairs close to Fort Sill!,"Simple 1-bedroom unit upstairs close to Fort Sill! is a apartment rental in Lawton, Oklahoma, USA. It has 1 bedroom(s) and 1 bathroom(s). Amenities include Air Conditioner, Parking, Pet Friendly, Security/Safety, Fireplace/Heating, Internet.",apartment,available,18.00,1,1,"Air Conditioner, Parking, Pet Friendly, Security/Safety, Fireplace/Heating, Internet",34.651274,-98.440963,https://beta.imgservice.rentbyowner.com/640x300/simple-1-bedroom-unit-upsta-us-lawton-bc-6974794-0.jpg,https://beta.imgservice.rentbyowner.com/640x300/simple-1-bedroom-unit-upsta-us-lawton-bc-6974794-1.jpg|https://beta.imgservice.rentbyowner.com/640x300/simple-1-bedroom-unit-upsta-us-lawton-bc-6974794-2.jpg|https://beta.imgservice.rentbyowner.com/640x300/simple-1-bedroom-unit-upsta-us-lawton-bc-6974794-3.jpg|https://beta.imgservice.rentbyowner.com/640x300/simple-1-bedroom-unit-upsta-us-lawton-bc-6974794-4.jpg,Living room|Bedroom|Kitchen|Outdoor area
Wilmington,Delaware,USA,39.745502,-75.548277,extraaps,"extraaps is a apartment rental in Wilmington, Delaware, USA. It has 1 bedroom(s) and 1 bathroom(s). Amenities include Air Conditioner, Security/Safety, Child Friendly.",apartment,available,18.00,1,1,"Air Conditioner, Security/Safety, Child Friendly",39.731202,-75.533767,https://beta.imgservice.rentbyowner.com/640x300/extraaps-us-wilmington-bc-15937722-0.jpg,https://beta.imgservice.rentbyowner.com/640x300/extraaps-us-wilmington-bc-15937722-1.jpg|https://beta.imgservice.rentbyowner.com/640x300/extraaps-us-wilmington-bc-15937722-2.jpg|https://beta.imgservice.rentbyowner.com/640x300/extraaps-us-wilmington-bc-15937722-3.jpg|https://beta.imgservice.rentbyowner.com/640x300/extraaps-us-wilmington-bc-15937722-4.jpg,Living room|Bedroom|Kitchen|Outdoor area
Sanger,California,USA,36.742801,-119.461271,Kings River Reflections,"Kings River Reflections is a house rental in Sanger, California, USA. It has 4 bedroom(s) and 4 bathroom(s). Amenities include Air Conditioner, Parking, Designated Smoking Area, TV, View, Ocean View, Balcony/Terrace, Oceanfront, Security/Safety, Sports/Activities, Fireplace/Heating, Restaurant, Guest Services, Entertainment, Barbecue/Outdoor Cooking, Child Friendly, Internet, Kitchen.",house,available,95.00,4,4,"Air Conditioner, Parking, Designated Smoking Area, TV, View, Ocean View, Balcony/Terrace, Oceanfront, Security/Safety, Sports/Activities, Fireplace/Heating, Restaurant, Guest Services, Entertainment, Barbecue/Outdoor Cooking, Child Friendly, Internet, Kitchen",36.750311,-119.448161,https://beta.imgservice.rentbyowner.com/640x300/kings-river-reflections-us-sanger-bc-12660331-0.jpg,https://beta.imgservice.rentbyowner.com/640x300/kings-river-reflections-us-sanger-bc-12660331-1.jpg|https://beta.imgservice.rentbyowner.com/640x300/kings-river-reflections-us-sanger-bc-12660331-2.jpg|https://beta.imgservice.rentbyowner.com/640x300/kings-river-reflections-us-sanger-bc-12660331-3.jpg|https://beta.imgservice.rentbyowner.com/640x300/kings-river-reflections-us-sanger-bc-12660331-4.jpg,Living room|Bedroom|Kitchen|Outdoor area
Pacific Palisades,California,USA,34.070872,-118.560683,Heaven's Best Kept Secret 4 Min From The Sea,"Heaven's Best Kept Secret 4 Min From The Sea is a house rental in Pacific Palisades, California, USA. It has 3 bedroom(s) and 2 bathroom(s). Amenities include Air Conditioner, Parking, Pet Friendly, Designated Smoking Area, TV, View, Ocean View, Balcony/Terrace, Oceanfront, Accessibility, Security/Safety, EV Charge Station, Sports/Activities, Wellness Facilities, Fireplace/Heating, Guest Services, Entertainment, Breakfast, Child Friendly, Internet, Kitchen, Laundry.",house,available,234.53,3,2,"Air Conditioner, Parking, Pet Friendly, Designated Smoking Area, TV, View, Ocean View, Balcony/Terrace, Oceanfront, Accessibility, Security/Safety, EV Charge Station, Sports/Activities, Wellness Facilities, Fireplace/Heating, Guest Services, Entertainment, Breakfast, Child Friendly, Internet, Kitchen, Laundry",34.062032,-118.577223,https://beta.imgservice.rentbyowner.com/640x300/heaven-s-best-ke-us-pacific-palisades-bc-3878259-0.jpg,https://beta.imgservice.rentbyowner.com/640x300/heaven-s-best-ke-us-pacific-palisades-bc-3878259-1.jpg|https://beta.imgservice.rentbyowner.com/640x300/heaven-s-best-ke-us-pacific-palisades-bc-3878259-2.jpg|https://beta.imgservice.rentbyowner.com/640x300/heaven-s-best-ke-us-pacific-palisades-bc-3878259-3.jpg|https://beta.imgservice.rentbyowner.com/640x300/heaven-s-best-ke-us-pacific-palisades-bc-3878259-4.jpg,Living room|Bedroom|Kitchen|Outdoor area
McHenry,Maryland,USA,39.556715,-79.357402,Lake Pointe Inn,"Lake Pointe Inn is a bed and breakfast rental in McHenry, Maryland, USA. It has 12 bedroom(s) and 12 bathroom(s). Amenities include Air Conditioner, Parking, View, Wheelchair Accessible, Private Beach, Ocean View, Balcony/Terrace, Oceanfront, Breakfast, Hot Tub, Internet.",bed and breakfast,available,298.00,12,12,"Air Conditioner, Parking, View, Wheelchair Accessible, Private Beach, Ocean View, Balcony/Terrace, Oceanfront, Breakfast, Hot Tub, Internet",39.563545,-79.340112,https://beta.imgservice.rentbyowner.com/640x300/lake-pointe-inn-us-mchenry-bc-4483488-0.jpg,https://beta.imgservice.rentbyowner.com/640x300/lake-pointe-inn-us-mchenry-bc-4483488-1.jpg|https://beta.imgservice.rentbyowner.com/640x300/lake-pointe-inn-us-mchenry-bc-4483488-2.jpg|https://beta.imgservice.rentbyowner.com/640x300/lake-pointe-inn-us-mchenry-bc-4483488-3.jpg|https://beta.imgservice.rentbyowner.com/640x300/lake-pointe-inn-us-mchenry-bc-4483488-4.jpg,Living room|Bedroom|Kitchen|Outdoor area
Cape May,New Jersey,USA,38.934512,-74.920443,The Hugh Boutique B&B,"The Hugh Boutique B&B is a bed and breakfast rental in Cape May, New Jersey, USA. It has 8 bedroom(s) and 8 bathroom(s). Amenities include Air Conditioner, Parking, View, Ocean View, Balcony/Terrace, Internet.",bed and breakfast,available,480.00,8,8,"Air Conditioner, Parking, View, Ocean View, Balcony/Terrace, Internet",38.926592,-74.928863,https://beta.imgservice.rentbyowner.com/640x300/the-hugh-boutique-b-b-us-cape-may-bc-6420106-0.jpg,https://beta.imgservice.rentbyowner.com/640x300/the-hugh-boutique-b-b-us-cape-may-bc-6420106-1.jpg|https://beta.imgservice.rentbyowner.com/640x300/the-hugh-boutique-b-b-us-cape-may-bc-6420106-2.jpg|https://beta.imgservice.rentbyowner.com/640x300/the-hugh-boutique-b-b-us-cape-may-bc-6420106-3.jpg|https://beta.imgservice.rentbyowner.com/640x300/the-hugh-boutique-b-b-us-cape-may-bc-6420106-4.jpg,Living room|Bedroom|Kitchen|Outdoor area
Saint Michaels,Maryland,USA,38.828105,-76.297211,Wades Point Inn on the Bay,"Wades Point Inn on the Bay is a bed and breakfast rental in Saint Michaels, Maryland, USA. It has 23 bedroom(s) and 24 bathroom(s). Amenities include Air Conditioner, Parking, Wheelchair Accessible, Balcony/Terrace, Internet.",bed and breakfast,available,288.84,23,24,"Air Conditioner, Parking, Wheelchair Accessible, Balcony/Terrace, Internet",38.842455,-76.313231,https://beta.imgservice.rentbyowner.com/640x300/wades-point-inn-on-us-saint-michaels-bc-1130948-0.jpg,https://beta.imgservice.rentbyowner.com/640x300/wades-point-inn-on-us-saint-michaels-bc-1130948-1.jpg|https://beta.imgservice.rentbyowner.com/640x300/wades-point-inn-on-us-saint-michaels-bc-1130948-2.jpg|https://beta.imgservice.rentbyowner.com/640x300/wades-point-inn-on-us-saint-michaels-bc-1130948-3.jpg|https://beta.imgservice.rentbyowner.com/640x300/wades-point-inn-on-us-saint-michaels-bc-1130948-4.jpg,Living room|Bedroom|Kitchen|Outdoor area
Athens,Georgia,USA,33.965237,-83.400961,"NormalBnB - 2 Blocks From Restaurants, Bars, Hospital","NormalBnB - 2 Blocks From Restaurants, Bars, Hospital is a apartment rental in Athens, Georgia, USA. It has 2 bedroom(s) and 2 bathroom(s). Amenities include Air Conditioner, Parking, View, Balcony/Terrace, Security/Safety, Sports/Activities, Fireplace/Heating, Guest Services, Internet.",apartment,available,177.00,2,2,"Air Conditioner, Parking, View, Balcony/Terrace, Security/Safety, Sports/Activities, Fireplace/Heating, Guest Services, Internet",33.960077,-83.406161,https://beta.imgservice.rentbyowner.com/640x300/normalbnb-2-blocks-from-res-us-athens-bc-6742164-0.jpg,https://beta.imgservice.rentbyowner.com/640x300/normalbnb-2-blocks-from-res-us-athens-bc-6742164-1.jpg|https://beta.imgservice.rentbyowner.com/640x300/normalbnb-2-blocks-from-res-us-athens-bc-6742164-2.jpg|https://beta.imgservice.rentbyowner.com/640x300/normalbnb-2-blocks-from-res-us-athens-bc-6742164-3.jpg|https://beta.imgservice.rentbyowner.com/640x300/normalbnb-2-blocks-from-res-us-athens-bc-6742164-4.jpg,Living room|Bedroom|Kitchen|Outdoor area
Galveston,Texas,USA,29.299250,-94.779640,Cozy Historic Beach Cottage II,"Cozy Historic Beach Cottage II is a house rental in Galveston, Texas, USA. It has 3 bedroom(s) and 2 bathroom(s). Amenities include Air Conditioner, Parking, Internet, Kitchen, Laundry.",house,available,157.00,3,2,"Air Conditioner, Parking, Internet, Kitchen, Laundry",29.307920,-94.769630,https://beta.imgservice.rentbyowner.com/640x300/cozy-historic-beach-cott-us-galveston-bc-3983612-0.jpg,https://beta.imgservice.rentbyowner.com/640x300/cozy-historic-beach-cott-us-galveston-bc-3983612-1.jpg|https://beta.imgservice.rentbyowner.com/640x300/cozy-historic-beach-cott-us-galveston-bc-3983612-2.jpg|https://beta.imgservice.rentbyowner.com/640x300/cozy-historic-beach-cott-us-galveston-bc-3983612-3.jpg|https://beta.imgservice.rentbyowner.com/640x300/cozy-historic-beach-cott-us-galveston-bc-3983612-4.jpg,Living room|Bedroom|Kitchen|Outdoor area
Provincetown,Massachusetts,USA,42.055166,-70.182571,Benchmark Inn,"Benchmark Inn is a bed and breakfast rental in Provincetown, Massachusetts, USA. It has 7 bedroom(s) and 7 bathroom(s). Amenities include Air Conditioner, Parking, Pool, View, Ocean View, Balcony/Terrace, Oceanfront, Security/Safety, Sports/Activities, Wellness Facilities, Fireplace/Heating, Guest Services, Entertainment, Hot Tub, Internet, Laundry.",bed and breakfast,available,592.00,7,7,"Air Conditioner, Parking, Pool, View, Ocean View, Balcony/Terrace, Oceanfront, Security/Safety, Sports/Activities, Wellness Facilities, Fireplace/Heating, Guest Services, Entertainment, Hot Tub, Internet, Laundry",42.044606,-70.191531,https://beta.imgservice.rentbyowner.com/640x300/benchmark-inn-us-provincetown-bc-394062-0.jpg,https://beta.imgservice.rentbyowner.com/640x300/benchmark-inn-us-provincetown-bc-394062-1.jpg|https://beta.imgservice.rentbyowner.com/640x300/benchmark-inn-us-provincetown-bc-394062-2.jpg|https://beta.imgservice.rentbyowner.com/640x300/benchmark-inn-us-provincetown-bc-394062-3.jpg|https://beta.imgservice.rentbyowner.com/640x300/benchmark-inn-us-provincetown-bc-394062-4.jpg,Living room|Bedroom|Kitchen|Outdoor area
Pasadena,California,USA,34.151170,-118.180984,The Patrician Hollywood Universal,"The Patrician Hollywood Universal is a house rental in Pasadena, California, USA. It has 5 bedroom(s) and 9 bathroom(s). Amenities include Air Conditioner, Parking, TV, View, Balcony/Terrace, Transportation/Shuttle, Security/Safety, Sports/Activities, Fireplace/Heating, Bar, Guest Services, Entertainment, Breakfast, Internet, Kitchen.",house,available,104.00,5,9,"Air Conditioner, Parking, TV, View, Balcony/Terrace, Transportation/Shuttle, Security/Safety, Sports/Activities, Fireplace/Heating, Bar, Guest Services, Entertainment, Breakfast, Internet, Kitchen",34.164040,-118.171074,https://beta.imgservice.rentbyowner.com/640x300/the-patrician-hollywood-u-us-pasadena-bc-2910673-0.jpg,https://beta.imgservice.rentbyowner.com/640x300/the-patrician-hollywood-u-us-pasadena-bc-2910673-1.jpg|https://beta.imgservice.rentbyowner.com/640x300/the-patrician-hollywood-u-us-pasadena-bc-2910673-2.jpg|https://beta.imgservice.rentbyowner.com/640x300/the-patrician-hollywood-u-us-pasadena-bc-2910673-3.jpg|https://beta.imgservice.rentbyowner.com/640x300/the-patrician-hollywood-u-us-pasadena-bc-2910673-4.jpg,Living room|Bedroom|Kitchen|Outdoor area
Radiant,Virginia,USA,38.322839,-78.194465,Hill of Content B&B,"Hill of Content B&B is a bed and breakfast rental in Radiant, Virginia, USA. It has 3 bedroom(s) and 3 bathroom(s). Amenities include Air Conditioner, Parking, Designated Smoking Area, Balcony/Terrace, Internet.",bed and breakfast,available,160.00,3,3,"Air Conditioner, Parking, Designated Smoking Area, Balcony/Terrace, Internet",38.330909,-78.201145,https://beta.imgservice.rentbyowner.com/640x300/hill-of-content-b-b-us-radiant-bc-5643765-0.jpg,https://beta.imgservice.rentbyowner.com/640x300/hill-of-content-b-b-us-radiant-bc-5643765-1.jpg|https://beta.imgservice.rentbyowner.com/640x300/hill-of-content-b-b-us-radiant-bc-5643765-2.jpg|https://beta.imgservice.rentbyowner.com/640x300/hill-of-content-b-b-us-radiant-bc-5643765-3.jpg|https://beta.imgservice.rentbyowner.com/640x300/hill-of-content-b-b-us-radiant-bc-5643765-4.jpg,Living room|Bedroom|Kitchen|Outdoor area
Crestline,California,USA,34.233750,-117.271263,Beautiful guesthouse in Crestline,"Beautiful guesthouse in Crestline is a house rental in Crestline, California, USA. It has 1 bedroom(s) and 1 bathroom(s). Amenities include Air Conditioner, Parking, Balcony/Terrace, Child Friendly, Internet, Kitchen.",house,available,110.00,1,1,"Air Conditioner, Parking, Balcony/Terrace, Child Friendly, Internet, Kitchen",34.219290,-117.262253,https://beta.imgservice.rentbyowner.com/640x300/beautiful-guesthouse-in-us-crestline-bc-5573212-0.jpg,https://beta.imgservice.rentbyowner.com/640x300/beautiful-guesthouse-in-us-crestline-bc-5573212-1.jpg|https://beta.imgservice.rentbyowner.com/640x300/beautiful-guesthouse-in-us-crestline-bc-5573212-2.jpg|https://beta.imgservice.rentbyowner.com/640x300/beautiful-guesthouse-in-us-crestline-bc-5573212-3.jpg|https://beta.imgservice.rentbyowner.com/640x300/beautiful-guesthouse-in-us-crestline-bc-5573212-4.jpg,Living room|Bedroom|Kitchen|Outdoor area
Volcano,Hawaii,USA,19.433449,-155.233996,Volcano Teapot Cottage,"Volcano Teapot Cottage is a house rental in Volcano, Hawaii, USA. It has 6 bedroom(s) and 1 bathroom(s). Amenities include Parking, View, Ocean View, Balcony/Terrace, Oceanfront, Accessibility, Transportation/Shuttle, Security/Safety, Sports/Activities, Guest Services, Internet.",house,available,225.00,6,1,"Parking, View, Ocean View, Balcony/Terrace, Oceanfront, Accessibility, Transportation/Shuttle, Security/Safety, Sports/Activities, Guest Services, Internet",19.449499,-155.229446,https://beta.imgservice.rentbyowner.com/640x300/volcano-teapot-cottage-us-volcano-bc-2501095-0.jpg,https://beta.imgservice.rentbyowner.com/640x300/volcano-teapot-cottage-us-volcano-bc-2501095-1.jpg|https://beta.imgservice.rentbyowner.com/640x300/volcano-teapot-cottage-us-volcano-bc-2501095-2.jpg|https://beta.imgservice.rentbyowner.com/640x300/volcano-teapot-cottage-us-volcano-bc-2501095-3.jpg|https://beta.imgservice.rentbyowner.com/640x300/volcano-teapot-cottage-us-volcano-bc-2501095-4.jpg,Living room|Bedroom|Kitchen|Outdoor area
Paducah,Kentucky,USA,37.088013,-88.601719,Belle Louise Historic Bed & Breakfast,"Belle Louise Historic Bed & Breakfast is a bed and breakfast rental in Paducah, Kentucky, USA. It has 6 bedroom(s) and 9 bathroom(s). Amenities include Air Conditioner, Parking, Designated Smoking Area, TV, View, Balcony/Terrace, Accessibility, Security/Safety, Sports/Activities, Fireplace/Heating, Guest Services, Entertainment, Breakfast, Internet.",bed and breakfast,available,202.33,6,9,"Air Conditioner, Parking, Designated Smoking Area, TV, View, Balcony/Terrace, Accessibility, Security/Safety, Sports/Activities, Fireplace/Heating, Guest Services, Entertainment, Breakfast, Internet",37.075513,-88.611699,https://beta.imgservice.rentbyowner.com/640x300/belle-louise-historic-bed-us-paducah-bc-6884438-0.jpg,https://beta.imgservice.rentbyowner.com/640x300/belle-louise-historic-bed-us-paducah-bc-6884438-1.jpg|https://beta.imgservice.rentbyowner.com/640x300/belle-louise-historic-bed-us-paducah-bc-6884438-2.jpg|https://beta.imgservice.rentbyowner.com/640x300/belle-louise-historic-bed-us-paducah-bc-6884438-3.jpg|https://beta.imgservice.rentbyowner.com/640x300/belle-louise-historic-bed-us-paducah-bc-6884438-4.jpg,Living room|Bedroom|Kitchen|Outdoor area
Glen Rose,Texas,USA,32.238430,-97.753783,Live Oak B&B,"Live Oak B&B is a bed and breakfast rental in Glen Rose, Texas, USA. It has 5 bedroom(s) and 5 bathroom(s). Amenities include Air Conditioner, Parking, Designated Smoking Area, Balcony/Terrace, Accessibility, Security/Safety, Sports/Activities, Wellness Facilities, Spa, Fireplace/Heating, Restaurant, Guest Services, Barbecue/Outdoor Cooking, Child Friendly, Hot Tub, Internet.",bed and breakfast,available,135.00,5,5,"Air Conditioner, Parking, Designated Smoking Area, Balcony/Terrace, Accessibility, Security/Safety, Sports/Activities, Wellness Facilities, Spa, Fireplace/Heating, Restaurant, Guest Services, Barbecue/Outdoor Cooking, Child Friendly, Hot Tub, Internet",32.244400,-97.760963,https://beta.imgservice.rentbyowner.com/640x300/live-oak-b-b-us-glen-rose-bc-2255521-0.jpg,https://beta.imgservice.rentbyowner.com/640x300/live-oak-b-b-us-glen-rose-bc-2255521-1.jpg|https://beta.imgservice.rentbyowner.com/640x300/live-oak-b-b-us-glen-rose-bc-2255521-2.jpg|https://beta.imgservice.rentbyowner.com/640x300/live-oak-b-b-us-glen-rose-bc-2255521-3.jpg|https://beta.imgservice.rentbyowner.com/640x300/live-oak-b-b-us-glen-rose-bc-2255521-4.jpg,Living room|Bedroom|Kitchen|Outdoor area
Auburn,New York,USA,42.898072,-76.549283,Serenity On The Lake,"Serenity On The Lake is a apartment rental in Auburn, New York, USA. It has 1 bedroom(s) and 1 bathroom(s). Amenities include Air Conditioner, Parking, View, Private Beach, Ocean View, Balcony/Terrace, Oceanfront, Security/Safety, Sports/Activities, Fireplace/Heating, Guest Services, Barbecue/Outdoor Cooking, Internet.",apartment,available,200.00,1,1,"Air Conditioner, Parking, View, Private Beach, Ocean View, Balcony/Terrace, Oceanfront, Security/Safety, Sports/Activities, Fireplace/Heating, Guest Services, Barbecue/Outdoor Cooking, Internet",42.894952,-76.557923,https://beta.imgservice.rentbyowner.com/640x300/serenity-on-the-lake-us-auburn-bc-3339604-0.jpg,https://beta.imgservice.rentbyowner.com/640x300/serenity-on-the-lake-us-auburn-bc-3339604-1.jpg|https://beta.imgservice.rentbyowner.com/640x300/serenity-on-the-lake-us-auburn-bc-3339604-2.jpg|https://beta.imgservice.rentbyowner.com/640x300/serenity-on-the-lake-us-auburn-bc-3339604-3.jpg|https://beta.imgservice.rentbyowner.com/640x300/serenity-on-the-lake-us-auburn-bc-3339604-4.jpg,Living room|Bedroom|Kitchen|Outdoor area
